{
  "window": {"start_ts": 1700000000000, "end_ts": 1700003600000},
  "bucket": {"time": "hour", "vol": "high", "liq": "low"},
  "symbol": "ETHUSDT",
  "level": "B",
  "template_id": "tpl_cap0",
  "metrics": {
    "emit_cnt": 0,
    "abstain_ratio": 1.0,
    "latency_p95_ms": "n/a",
    "utility_precision": 0.00,
    "gate_reject_rate": 0.00,
    "ttl_expire_rate": 0.00
  }
}
